<?xml version="1.0" encoding="UTF-8"?>

<!ELEMENT torneo(participante+)>
<!ATTLIST torneo edicion CDATA #REQUIRED>
<!ATTLIST torneo anteriorGanador CDATA #REQUIRED>

<!ELEMENT participante(nombre, edad, pais, cabezaDeSerie?)>
<!ATTLIST participante codigo ID #REQUIRED>
<!ATTLIST participante compaÃ±ero CDATA #REQUIRED>

<!ELEMENT nombre (#PCDATA)>
<!ELEMENT edad (#PCDATA)>
<!ELEMENT pais (#PCDATA)>
<!ELEMENT cabezaDeSerie EMPTY>
